{
  "session_id": "a1b2c3d4-e5f6-7a8b-9c0d-1e2f3a4b5c6d",
  "epoch": 1,
  "sequence": 15,
  "timestamp_utc": "2026-09-15T16:48:15.000Z",
  "target_person_id": "person_track_01",
  "exercise_key": "bodyweight_squat",
  "exercise_version": 1,
  "tracking_state": "AMBIGUOUS",
  "visibility_state": "PARTIAL",
  "reason_code": "TARGET_AMBIGUOUS"
}
